{
  "model_id": "llama3.1-8b",
  "suite_id": "general_v1",
  "sample_size": 50,
  "metrics": {
    "accuracy": 0.91,
    "faithfulness": 0.88,
    "toxicity_rate": 0.01
  },
  "thresholds": {
    "min_accuracy": 0.8,
    "min_faithfulness": 0.75,
    "max_toxicity_rate": 0.05,
    "min_sample_size": 10
  },
  "notes": "Sample golden-set evaluation."
}
